{
  "$schema": "../schemas/discovery-taxonomy.schema.json",
  "policyId": "discovery-taxonomy.v1",
  "version": 1,
  "status": "draft-but-authoritative",
  "purpose": "Canonical mapping från Viewser discovery-wizardens 25 WizardCategoryId-värden till targetScaffoldId/activeScaffoldId/fallbackScaffoldId/defaultVariantId/expectedStarterId/requestedCapabilities/candidateDossiers/recommendedPages. Stänger B121 backendsida: discovery-sanning behöver inte längre passera WizardAnswers, DiscoveryPayload, briefModel/masterprompt och _apply_discovery_overrides utan en explicit konfliktlösare. Backendens Discovery Resolver (packages/generation/discovery/resolve.py) läser denna policy och avgör selectedScaffoldId/selectedVariantId/expectedStarterId + fieldSources + fallbackWarnings. PR B låser frontend mot denna policy (governance-driven eller governance-verifierad); PR C lägger Backoffice-control för editering.",
  "principles": [
    "Wizardens kategori-id är kontraktet; scaffold/variant/starter är implementationen. Saknad kategori-mapping är ett fynd, inte ett tyst fallback.",
    "Bara två scaffolds är runtime-aktiva idag: local-service-business (-> marketing-base) och ecommerce-lite (-> commerce-base). Alla andra kategorier får supportStatus=planned tills scaffold-runtime + starter-mapping finns.",
    "targetScaffoldId speglar produktens målbild och får peka mot framtida scaffold i scaffold-contract.v1.json. activeScaffoldId / fallbackScaffoldId måste vara byggbar idag, dvs finnas under packages/generation/orchestration/scaffolds/<id>/ med variants/ och vara med i planning.SCAFFOLD_TO_STARTER.",
    "Wizarden får inte sätta starterId direkt. expectedStarterId i taxonomin är förväntat värde härlett från selectedScaffoldId; produce_site_plan är canonical för faktisk starter-resolution.",
    "candidateDossiers är förslag, inte beslut. Resolvern hjälper Backoffice se kandidater, men planning + capability-filter avgör vad som faktiskt monteras. Inga nya Dossier-klasser införs här."
  ],
  "contentBranches": [
    { "id": "ecommerce", "labelSv": "E-handel", "priority": 0 },
    { "id": "restaurant", "labelSv": "Restaurang", "priority": 1 },
    { "id": "salon", "labelSv": "Salong & hälsa", "priority": 2 },
    { "id": "portfolio", "labelSv": "Portfolio & kreatör", "priority": 3 },
    { "id": "hotel", "labelSv": "Hotell & resa", "priority": 4 },
    { "id": "construction", "labelSv": "Bygg & motor", "priority": 5 },
    { "id": "education", "labelSv": "Utbildning", "priority": 6 },
    { "id": "event", "labelSv": "Event", "priority": 7 },
    { "id": "legal", "labelSv": "Juridik & ekonomi", "priority": 8 },
    { "id": "realestate", "labelSv": "Fastighet", "priority": 9 },
    { "id": "nonprofit", "labelSv": "Förening", "priority": 10 },
    { "id": "consulting", "labelSv": "Konsult & tech", "priority": 11 },
    { "id": "business", "labelSv": "Företag & tjänster", "priority": 12 },
    { "id": "minimal", "labelSv": "Minimal / landningssida", "priority": 13 }
  ],
  "categories": [
    {
      "id": "business",
      "labelSv": "Företag / Tjänster",
      "labelEn": "Business / Services",
      "contentBranch": "business",
      "supportStatus": "active",
      "targetScaffoldId": "local-service-business",
      "activeScaffoldId": "local-service-business",
      "defaultVariantId": "nordic-trust",
      "expectedStarterId": "marketing-base",
      "requestedCapabilities": ["contact-form"],
      "candidateDossiers": [],
      "recommendedPages": [
        "Startsida / Hero",
        "Om oss / Om mig",
        "Vårt team",
        "Kundrecensioner",
        "Kontaktformulär"
      ],
      "rationale": "Generisk tjänsteleverantör matchar local-service-business 1:1. Aktiv runtime."
    },
    {
      "id": "ecommerce",
      "labelSv": "Webshop / E-handel",
      "labelEn": "E-commerce",
      "contentBranch": "ecommerce",
      "supportStatus": "active",
      "targetScaffoldId": "ecommerce-lite",
      "activeScaffoldId": "ecommerce-lite",
      "defaultVariantId": "clean-store",
      "expectedStarterId": "commerce-base",
      "requestedCapabilities": ["payments", "contact-form"],
      "candidateDossiers": [],
      "recommendedPages": [
        "Startsida / Hero",
        "Webshop / Produkter",
        "Om oss / Om mig",
        "FAQ",
        "Kontaktformulär"
      ],
      "rationale": "Webshop mappas direkt mot ecommerce-lite + commerce-base. Aktiv runtime."
    },
    {
      "id": "restaurant",
      "labelSv": "Restaurang / Café",
      "labelEn": "Restaurant / Cafe",
      "contentBranch": "restaurant",
      "supportStatus": "active",
      "targetScaffoldId": "restaurant-hospitality",
      "activeScaffoldId": "restaurant-hospitality",
      "fallbackScaffoldId": "local-service-business",
      "defaultVariantId": "warm-bistro",
      "expectedStarterId": "marketing-base",
      "requestedCapabilities": ["contact-form", "faq-section"],
      "candidateDossiers": [],
      "recommendedPages": [
        "Startsida / Hero",
        "Meny / Matsedel",
        "Bokning online",
        "Bildgalleri",
        "Karta / Hitta hit",
        "Om oss / Om mig"
      ],
      "rationale": "Restaurang mappas mot restaurant-hospitality + marketing-base. Aktiv runtime via Path A (render_menu + render_booking i build_site.py). fallbackScaffoldId behålls som säkerhetsnät om scaffold-mappingen tillfälligt skulle haverera.",
      "operatorNotes": "Promoterad till active 2026-05-25 via GAP-backend-restaurant-activation. Path B (section-driven renderer) löser ut renderer-utbredningen för övriga 11 scaffolds."
    },
    {
      "id": "portfolio",
      "labelSv": "Portfolio / CV",
      "labelEn": "Portfolio / CV",
      "contentBranch": "portfolio",
      "supportStatus": "planned",
      "targetScaffoldId": "portfolio-creator",
      "fallbackScaffoldId": "local-service-business",
      "defaultVariantId": "nordic-trust",
      "expectedStarterId": "marketing-base",
      "requestedCapabilities": ["carousel", "contact-form"],
      "candidateDossiers": [],
      "recommendedPages": [
        "Startsida / Hero",
        "Portfolio / Case",
        "Om oss / Om mig",
        "Kontaktformulär"
      ],
      "rationale": "Portfolio är planerad mot portfolio-creator + portfolio-base. Fallback till local-service-business med marketing-base tills runtime finns."
    },
    {
      "id": "landing",
      "labelSv": "Landningssida",
      "labelEn": "Landing page",
      "contentBranch": "minimal",
      "supportStatus": "planned",
      "targetScaffoldId": "app-landing",
      "fallbackScaffoldId": "local-service-business",
      "defaultVariantId": "nordic-trust",
      "expectedStarterId": "marketing-base",
      "requestedCapabilities": ["contact-form", "newsletter-subscribe"],
      "candidateDossiers": [],
      "recommendedPages": [
        "Startsida / Hero",
        "Kontaktformulär"
      ],
      "rationale": "Single-page-fokus matchar app-landing-scaffolden. Fallback till local-service-business tills app-landing/scaffold.json finns."
    },
    {
      "id": "blog",
      "labelSv": "Blogg / Magasin",
      "labelEn": "Blog / Magazine",
      "contentBranch": "business",
      "supportStatus": "fallback",
      "targetScaffoldId": "local-service-business",
      "fallbackScaffoldId": "local-service-business",
      "defaultVariantId": "nordic-trust",
      "expectedStarterId": "marketing-base",
      "requestedCapabilities": ["newsletter-subscribe", "contact-form"],
      "candidateDossiers": [],
      "recommendedPages": [
        "Startsida / Hero",
        "Blogg / Nyheter",
        "Om oss / Om mig",
        "Nyhetsbrev",
        "Kontaktformulär"
      ],
      "rationale": "Bloggsajter saknar dedikerad magazine-/CMS-scaffold i scaffold-contract.v1.json. Kör local-service-business + marketing-base som vikariat tills en magasin-scaffold landas via ADR. Backoffice ser fallback-status så denna mappning inte förväxlas med native scaffold-stöd.",
      "operatorNotes": "Promotera till active eller skapa egen scaffold när en magasin/CMS-mapping landas (ADR + scaffold-contract bump)."
    },
    {
      "id": "consulting",
      "labelSv": "Konsult / Byrå",
      "labelEn": "Consulting / Agency",
      "contentBranch": "consulting",
      "supportStatus": "planned",
      "targetScaffoldId": "consultant-expert",
      "fallbackScaffoldId": "local-service-business",
      "defaultVariantId": "nordic-trust",
      "expectedStarterId": "marketing-base",
      "requestedCapabilities": ["contact-form", "faq-section"],
      "candidateDossiers": [],
      "recommendedPages": [
        "Startsida / Hero",
        "Om oss / Om mig",
        "Vårt team",
        "Priser och paket",
        "Kundrecensioner",
        "Kontaktformulär"
      ],
      "rationale": "Konsult/byrå pekar mot consultant-expert eller agency-studio. Båda är planned; fallback till local-service-business."
    },
    {
      "id": "tech",
      "labelSv": "Tech / Startup",
      "labelEn": "Tech / Startup",
      "contentBranch": "consulting",
      "supportStatus": "planned",
      "targetScaffoldId": "saas-product",
      "fallbackScaffoldId": "local-service-business",
      "defaultVariantId": "nordic-trust",
      "expectedStarterId": "marketing-base",
      "requestedCapabilities": ["analytics", "contact-form"],
      "candidateDossiers": [],
      "recommendedPages": [
        "Startsida / Hero",
        "Om oss / Om mig",
        "Priser och paket",
        "Blogg / Nyheter",
        "Kontaktformulär"
      ],
      "rationale": "SaaS/Tech mappas mot saas-product + saas-base. Saas-base är registrerad placeholder; fallback till local-service-business tills runtime aktiveras."
    },
    {
      "id": "healthcare",
      "labelSv": "Vård / Klinik",
      "labelEn": "Healthcare / Clinic",
      "contentBranch": "salon",
      "supportStatus": "active",
      "targetScaffoldId": "clinic-healthcare",
      "activeScaffoldId": "clinic-healthcare",